{
  "$schema": "http://json-schema.org/draft-07/schema#",
  "$ref": "#/definitions/PaymentAuthorizationReversal",
  "definitions": {
    "PaymentAuthorizationReversal": {
      "description": "An authorization reversal alerts the issuer that part or all of a sale has been cancelled and the authorization hold should be rescinded",
      "type": "object",
      "additionalProperties": true,
      "required": [
        "id",
        "paymentAuthorizationReversalStatus",
        "paymentAuthorizationProcessingMode",
        "authorizationReversalAmount",
        "paymentAuthorizationId"
      ],
      "properties": {
        "id": {
          "anyOf": [
            {
              "type": "string"
            },
            {
              "type": "null"
            }
          ],
          "description": "Unique identifier for the entity, can be null on create if auto-generated"
        },
        "name": {
          "type": "string",
          "description": "Short description of the payment authorization reversal entry"
        },
        "paymentAuthorizationReversalStatus": {
          "type": "string",
          "description": "Processing stage of the payment authorization reversal"
        },
        "paymentAuthorizationProcessingMode": {
          "type": "string",
          "description": "Describes whether the payment processing was done by the platform or by an external system"
        },
        "authorizationReversalAmount": {
          "type": "number",
          "description": "Amount that was previously authorized and is now being reversed"
        },
        "paymentAuthorizationId": {
          "type": "string",
          "description": "References the original payment authorization that is being reversed"
        },
        "capturePaymentId": {
          "type": "string",
          "description": "References the capture payment the refund allocation applies to"
        },
        "customerEmailAddress": {
          "type": "string",
          "description": "Email address that is used in the authorization/reversal process"
        },
        "customerPhoneNumber": {
          "type": "string",
          "description": "Phone number that is used in the authorization/reversal process"
        },
        "gatewayRequestDateTime": {
          "type": "string",
          "description": "Date and time when the payment platform sent the authorization request to the gateway",
          "format": "date-time"
        },
        "paymentGatewayDateTime": {
          "type": "string",
          "description": "Datetime provided by the gateway after successful communication",
          "format": "date-time"
        },
        "paymentGatewayReferenceNumber": {
          "type": "string",
          "description": "Unique transaction identifier generated by payment gateway"
        },
        "paymentGatewayResultCode": {
          "type": "string",
          "description": "Result code returned by the gateway"
        },
        "paymentGatewayInternalReferenceNumber": {
          "type": "string",
          "description": "Unique transaction identifier generated by the internal payment platform"
        },
        "paymentGatewayInternalResultCode": {
          "type": "string",
          "description": "Internal result code returned by the internal payment platform"
        },
        "ipAddress": {
          "type": "string",
          "description": "Unique network address of the device that originated the payment authorization request"
        },
        "macAddress": {
          "type": "string",
          "description": "Unique hardware identification number of the device that originated the payment authorization request"
        },
        "commentText": {
          "type": "string",
          "description": "Descriptive text about the payment authorization reversal"
        },
        "externalCreatedDate": {
          "anyOf": [
            {
              "type": "string",
              "format": "date"
            },
            {
              "type": "null"
            }
          ],
          "description": "Preserves original creation date for payments imported from external systems"
        },
        "auditInfo": {
          "type": "object",
          "description": "Audit information for the entity",
          "additionalProperties": true,
          "required": [
            "createdBy",
            "isDeleted",
            "updatedBy",
            "updatedDate",
            "createdDate"
          ],
          "properties": {
            "createdDate": {
              "anyOf": [
                {
                  "type": "string",
                  "format": "date-time"
                },
                {
                  "type": "null"
                }
              ],
              "description": "Timestamp of when the entity was created"
            },
            "createdBy": {
              "type": "string",
              "description": "Identifies the system or user which created the entity"
            },
            "updatedDate": {
              "anyOf": [
                {
                  "type": "string",
                  "format": "date-time"
                },
                {
                  "type": "null"
                }
              ],
              "description": "Timestamp of when the entity was last updated"
            },
            "updatedBy": {
              "type": "string",
              "description": "Identifies the system or user which last updated the entity"
            },
            "isDeleted": {
              "anyOf": [
                {
                  "type": "boolean"
                },
                {
                  "type": "null"
                }
              ],
              "description": "Indicates whether or not the entity has been soft-deleted"
            }
          }
        }
      }
    }
  }
}